,Name,Ingredients,Result,Num ingredients
0,Solid Gold Bison,"[u'Bison', u' Ocean Fish Meal', u' Brown Rice', u' Peas', u' Canola Oil (preserved with Mixed Tocopherols)', u' Oatmeal', u' Pea Protein', u' Dried Eggs', u' Rice Bran', u' Pearled Barley', u' Salmon Meal', u' Tomato Pomace', u' Natural Flavor', u' Flaxseed', u' Salt', u' Choline Chloride', u' DL-Methionine', u' Potassium Chloride', u' Salmon Oil (preserved with Mixed Tocopherols)', u' Taurine', u' L-Carnitine', u' Carrots', u' Parsley', u' Apples', u' Cranberries', u' Blueberries', u' Lettuce', u' Celery', u' Beets', u' Watercress', u' Spinach', u' Dried Chicory Root', u' Broccoli', u' Spearmint', u' Almond Oil (preserved with Mixed Tocopherols)', u' Sesame Oil (preserved with Mixed Tocopherols)', u' Yucca Schidigera Extract', u' Dried Kelp', u' Thyme', u' Lentils', u' Vitamin A Supplement', u' Vitamin D3 Supplement', u' Vitamin E Supplement', u' Zinc Sulfate', u' Niacin', u' Ferrous Sulfate', u' L-Ascorbyl-2-Polyphosphate (source of Vitamin C)', u' Calcium Pantothenate', u' Thiamine Mononitrate', u' Copper Sulfate', u' Riboflavin', u' Pyridoxine Hydrochloride', u' Manganese Sulfate', u' Zinc Proteinate', u' Folic Acid', u' Calcium Iodate', u' Manganese Proteinate', u' Copper Proteinate', u' Sodium Selenite', u' Biotin', u' Vitamin B12 Supplement', u' Rosemary Extract', u' Dried Lactobacillus Acidophilus Fermentation Product', u' Dried Enterococcus Faecium Fermentation Product', u' Dried Lactobacillus Casei Fermentation Product']",1,65
1,Solid Gold Lamb,"[u'Lamb', u' Lamb Meal', u' Ocean Fish Meal', u' Pea Protein', u' Sweet Potatoes', u' Peas', u' Chickpeas', u' Chicken Fat (Preserved with Mixed Tocopherols)', u' Cranberries', u' Natural Flavors', u' Flaxseed', u' Dried Egg', u' Potassium Chloride', u' Salt', u' Choline Chloride', u' Salmon Oil (Preserved with Mixed Tocopherols)', u' DL-Methionine', u' Carrots', u' Pumpkin', u' Parsley', u' Apples', u' Blueberries', u' Lettuce', u' Celery', u' Beets', u' Watercress', u' Spinach', u' Dried Chicory Root', u' Broccoli', u' Spearmint', u' Almond Oil (Preserved with Mixed Tocopherols)', u' Sesame Oil (Preserved with Mixed Tocopherols)', u' Yucca Schidigera Extract', u' Dried Kelp', u' Thyme', u' Lentils', u' Vitamin A Supplement', u' Vitamin D3 Supplement', u' Vitamin E Supplement', u' Zinc Sulfate', u' Niacin', u' Ferrous Sulfate', u' L-Ascorbyl-2-Polyphosphate (Source of Vitamin C)', u' Calcium Pantothenate', u' Thiamine Mononitrate', u' Copper Sulfate', u' Riboflavin', u' Pyridoxine Hydrochloride', u' Manganese Sulfate', u' Zinc Proteinate', u' Folic Acid', u' Calcium Iodate', u' Manganese Proteinate', u' Copper Proteinate', u' Sodium Selenite', u' Biotin', u' Vitamin B12 Supplement', u' Rosemary Extract', u' Dried Lactobacillus Acidophilus Fermentation Product', u' Dried Enterococcus Faecium Fermentation Product', u' Dried Lactobacillus Casei Fermentation Product']",0,61
2,Lotus Chicken,"[u'Chicken', u' Chicken Meal', u'Whole Ground Rye Whole Ground Brown Rice', u' Pollock', u' Ground Barley', u' Oatmeal', u' Pea Fiber', u' Organic Soybean oil (preserved with mixed tocopherols and citric acid)', u' Dried Egg Product', u' Brewers Dried Yeast', u' Pumpkin', u' Apples', u' Sweet Potatoes', u' Carrots', u' Spinach', u' Blueberries', u' Potassium Chloride', u' Olive Oil', u' Salmon Oil', u' Flaxseed', u' Garlic', u' Salt', u' Zinc Proteinate', u' L-Ascrobyl-2-Polyphosphate (a source of Vitamin C)', u' Calcium Carbonate', u' Glucosamine Hydrochloride', u' Iron Proteinate', u' Chondroitin Sulfate', u' Vitamin E Supplement', u' Copper Proteinate', u' Manganese Proteinate', u' Dried Lactobacillus acidophilus fermentation soluble', u' Dried Lactobacillus lactis fermentation soluble', u' and Dried Lactobacillus casei fermentation soluble', u' Inulin', u' Yucca schidigera extract', u' Dried Kelp', u' Niacin', u' Sodium Selenite', u' Calcium Pantothenate', u' Folic Acid', u' Vitamin A Supplement', u' Riboflavin', u' Calcium Iodate', u' Vitamin B12 Supplement', u' Thiamine Mononitrate', u' Pyridoxine Hydrochloride (source of Vitamin B6)', u' Vitamin D3 Supplement', u' Rosemary Extract']",0,49
3,Beef frittata veg,"[u'Beef', u' Peas', u' Dried Whole Egg', u' Potatoes', u' Pea Protein', u' Pork Meat Meal', u' Beef Liver', u' Sweet Potatoes', u' Dried Tomato Pomace', u' Salmon Oil', u' Flaxseed', u' Cheese', u' Carrots', u' Broccoli', u' Cauliflower', u' Apples', u' Green Beans', u' Pork Cartilage', u' Potassium Chloride', u' Cranberries', u' Blueberries', u' Salt', u' Chicory Root Extract', u' Alfalfa Sprouts', u' Celery', u' Lettuce', u' Watercress', u' Spinach', u' Yucca Schidigera Extract', u' Sodium Selenite', u' Folic Acid', u' Taurine', u' Parsley', u' Sorbic Acid (Preservative)', u' Vitamins', u' Minerals', u' Probiotics']",0,37
4,Royal Canin Mini Special,"[u'Chicken meal', u' brewers rice', u' chicken fat', u' corn gluten meal', u' brewers rice flour', u' dried beet pulp', u' natural flavors', u' wheat gluten', u' brewers dried yeast', u' fish oil', u' sodium silico aluminate', u' vegetable oil', u' potassium chloride', u' L-lysine', u' fructooligosaccharides', u' sodium tripolyphosphate', u' salt', u' DL-methionine', u' taurine', u' vitamins DL-alpha tocopherol acetate (source of vitamin E)', u' inositol', u' niacin supplement', u' L-ascorbyl-2-polyphosphate (source of vitamin C)', u' D-calcium pantothenate', u' biotin', u' pyridoxine hydrochloride (vitamin B6)', u' riboflavin supplement (vitamin B2)', u' thiamine mononitrate (vitamin B1)', u' vitamin A acetate', u' folic acid', u' vitamin B12 supplement', u' vitamin D3 supplement', u' choline chloride', u' trace minerals (zinc proteinate', u' zinc oxide', u' ferrous sulfate', u' manganese proteinate', u' copper proteinate', u' copper sulfate', u' manganous oxide', u' calcium iodate', u' sodium selenite)', u' L-carnitine', u' rosemary extract', u' preserved with natural mixed tocopherols and citric acid']",0,45
5,Wellness CORE Small Breed,"[u'Deboned Turkey', u' Turkey Meal', u' Chicken Meal', u' Potatoes', u' Peas', u' Dried Ground Potatoes', u' Chicken Fat (preserved with Mixed Tocopherols)', u' Tomato Pomace', u' Natural Chicken Flavor', u' Ground Flaxseed', u' Salmon Oil', u' Yucca Schidigera Extract', u' Choline Chloride', u' Spinach', u' Vitamin E Supplement', u' Broccoli', u' Carrots', u' Parsley', u' Apples', u' Blueberries', u' Kale', u' Sweet Potatoes', u' Taurine', u' Spearmint', u' Mixed Tocopherols added to preserve freshness', u' Zinc Proteinate', u' Zinc Sulfate', u' Glucosamine Hydrochloride', u' Chondroitin Sulfate', u' Calcium Carbonate', u' Niacin', u' Ferrous Sulfate', u' Iron Proteinate', u' Beta-Carotene', u' Vitamin A Supplement', u' Copper Sulfate', u' Thiamine Mononitrate', u' Copper Proteinate', u' Manganese Proteinate', u' Manganese Sulfate', u' d-Calcium Pantothenate', u' Sodium Selenite', u' Pyridoxine Hydrochloride', u' Riboflavin', u' Chicory Root Extract', u' Vitamin D3 Supplement', u' Biotin', u' Calcium Iodate', u' Vitamin B12 Supplement', u' Folic Acid', u' Ascorbic Acid (Vitamin C)', u' Dried Lactobacillus plantarum Fermentation Product', u' Dried Enterococcus faecium Fermentation Product', u' Dried Lactobacillus casei Fermentation Product', u' Dried Lactobacillus acidophilus Fermentation Product', u' Rosemary Extract', u' Green Tea Extract', u' Spearmint Extract']",0,58
6,Instinct Limited Ingredient - Lamb,"[u'Lamb Meal', u' Peas', u' Tapioca', u' Pea Protein', u' Canola Oil (preserved with Mixed Tocopherols and Citric Acid)', u' Lamb', u' Natural Flavor', u' Montmorillonite Clay', u' Coconut Oil', u' Salt', u' Vitamins (Vitamin E Supplement', u' L-Ascorbyl-2-Polyphosphate', u' Niacin Supplement', u' Thiamine Mononitrate', u' d-Calcium Pantothenate', u' Vitamin A Supplement', u' Riboflavin Supplement', u' Pyridoxine Hydrochloride', u' Vitamin B12 Supplement', u' Folic Acid', u' Vitamin D3 Supplement', u' Biotin)', u' Potassium Chloride', u' Choline Chloride', u' DL-Methionine', u' Minerals (Zinc Proteinate', u' Iron Proteinate', u' Copper Proteinate', u' Manganese Proteinate', u' Sodium Selenite', u' Ethylenediamine Dihydriodide)', u' Freeze Dried Lamb', u' Pumpkinseeds', u' Freeze Dried Lamb Liver', u' Freeze Dried Lamb Spleen', u' Freeze Dried Lamb Heart', u' Freeze Dried Lamb Kidney', u' Rosemary Extract.']",1,38
